,Course ID,Course Title,Course Description,University,Location,Course Title Stripped,Minor Cluster,Minor Cluster Name,Major Cluster,Major Cluster Name
821,CS 556,Cyber-Physical Systems: Languages and Systems,"Different from general-purpose and traditional computer applications, cyber-physical systems have both continuous and discrete components, hence requiring new methodologies to integrate traditional continuous control theory/systems with traditional discrete software systems. The focus of this course is to discuss and understand the challenges in emerging cyber-physical systems and to explore possible solutions from the perspectives of systems specification, system modeling, programming languages, systems designs, and software engineering. This course will focus on the languages and systems aspects of cyber-physical systems.",Illinois Institute of Tech,"Chicago, Illinois ",,3,Other,2,Topics
822,MATH 483,Design and Analysis of Experiments,"Review of elementary probability and statistics; analysis of variance for design of experiments; estimation of parameters; confidence intervals for various linear combinations of the parameters; selection of sample sizes; various plots of residuals; block designs; Latin squares; one, two, and 2^k factorial designs; nested and cross factor designs; regression; nonparametric techniques.",Illinois Institute of Tech,"Chicago, Illinois ","design, analysis",3,Other,2,Topics
823,ACC 652,Accounting Analytics,"This course covers accounting analytics including Benford’s Law, current and prior period data, and anomaly detection. Students learn correlation and time series detection, risk assessment and risk scoring, and purchasing card transaction fraud.",Syracuse,"Syracuse, New York",accounting,3,Other,2,Topics
824,BE 521,Brain-Computer Interfaces,"The course is geared to advanced undergraduate and graduate students interested in understanding the basics of implantable neuro-devices, their design, practical implementation, approval, and use. Reading will cover the basics of neuro signals, recording, analysis, classification, modulation, and fundamental principles of Brain-Machine Interfaces. The course will be based upon twice weekly lectures and ""hands-on"" weekly assignments that teach basic signal recording, feature extraction, classification and practical implementation in clinical systems. Assignments will build incrementally toward constructing a complete, functional BMI system. Fundamental concepts in neurosignals, hardware and software will be reinforced by practical examples and in-depth study. Guest lecturers and demonstrations will supplement regular lectures.",University of Pennsylvania,"Philadelphia, Pennsylvania",brain-computer,0,Thesis,2,Topics
825,BE 537,Biomedical Image Analysis,"This course covers the fundamentals of advanced quantitative image analysis that apply to all of the major and emerging modalities in biological/biomaterials imaging and in vivo biomedical imaging. While traditional image processing techniques will be discussed to provide context, the emphasis will be on cutting edge aspects of all areas of image analysis (including registration, segmentation, and high-dimensional statistical analysis). Significant coverage of state-of-the-art biomedical research and clinical applications will be incorporated to reinforce the theoretical basis of the analysis methods.",University of Pennsylvania,"Philadelphia, Pennsylvania","image, analysis",3,Other,2,Topics
826,BIOSTAT 902,Missing Data Analysis: Theory and Application,"Theory and application of missing data methodology, ad hoc methods, missing data mechanism, selection models, pattern mixture models, likelihood-based methods, multiple imputation, inverse probability weighting, sensitivity analysis.",Duke,"Durham, North Carolina","analysis, theory, application",1,Software,7,Computer Science
827,605.632,Graph Analytics,"Graphs are a flexible data structure that facilitates fusion of disparate data sets. Applications of graphs have shown steady growth with the development of Internet, cyber, and social networks, presenting large graphs for which analysis remains a challenging problem. This course introduces algorithms and techniques to address large-scale graph analytics. It will blend graph analytics theory, hands-on development of graph analytics algorithms, as well as processing approaches that support the analytics. We will start by introducing graphs, their properties, and example applications, including necessary background on probability and linear algebra. Statistical properties of random and scale-free graphs will be introduced. Graph analytic methods, including centrality measures, graph clustering, partitioning, link inference, and dynamic graph processes such as diffusion, contagion, and opinion formation will be covered. Application of graph analytics to high-dimensional data analysis and data clustering will be discussed. Students will use standard graph interfaces as well as linear algebra-based methods to analyze graphs. Parallelization of analytics to handle larger-scale graphs will be discussed. Students will identify and apply suitable algorithms and analysis techniques to a variety of graph analytics problems, as well as gain experience setting up and solving these problems. There will be hands-on programming assignments",Johns Hopkins,"Baltimore, Maryland",graph,2,Visualization,6,Visualization
828,CSP 504/BCS 510,Data Analysis I,"Issues of data analysis in experimental research. The course focuses on parametric techniques, specifically analysis of variance. Topics covered include simple and complex designs for between and within subjects factors, including mixed designs; analysis of covariance and trend and contrasts. The course includes a lab in which students are taught to use a popular statistical package for data analysis",University of Rochester,"Rochester, New York","analysis, i",3,Other,2,Topics
829,BCS 513,Introduction to fMRI,"The core focus of the course will be on how fMRI can be used to ask questions about neural representations and cognitive and perceptual information processing. Some of the questions that the course will address include: 1) The basic fMRI signal just shows activation in different parts of the brain. How can we get from that to addressing questions about neural representations and neural information processing? 2) Ways of relating neural activation to behavioural performance. Can fMRI provide information over and above what can be obtained from behaviour alone? 3) Standard fMRI analysis using the General Linear Model, including preprocessing steps. 4) Multivariate fMRI analysis using machine learning approaches. There will also be a component, about 20% of the class, on the big-picture aspects of MRI physics and physiology which make fMRI possible.",University of Rochester,"Rochester, New York",introduction,2,Visualization,6,Visualization
830,ENMG661,Leading Virtual/Global Teams,"This course is designed to help the student apply managerial concepts and skills to managing and leading virtual and/or global work teams. Geographically dispersed work teams have great challenges: tone is difficult to convey electronically, time zones limit audio communication opportunities, work oversight requires more reposting, and team building is exceedingly difficult using technological - rather than in-person - tools. Language and culture differences in multinational teams compound these challenges. Students will learn to empower others, build credibility, communicate appropriately and adapt quickly across cultures and technologies.",University of Maryland--College Park,"Adelphi, Maryland",,3,Other,2,Topics
831,PSY 762,Functional Magnetic Resonance Imaging,"The course covers all aspects of functional magnetic resonance imaging, from its basic principles in physics, engineering, biophysics, and physiology; through computational, analytic, and signal processing issues; to its applications in neurobiology and cognitive neuroscience. The course will consist of weekly lectures and integrated laboratory sessions. Lectures will be given by BIAC faculty, and will incorporate primary readings in the field to encourage discussion. The laboratory sessions will involve analysis of fMRI data sets that illustrate issues discussed in the lectures. Students will gain experience both in the theoretical principles of fMRI and in the practical aspects of experimental design and data analysis.",Duke,"Durham, North Carolina","resonance, imaging",3,Other,2,Topics
832,MEAM 537,Nanotribology,"Engineering is progressing to ever smaller scales, enabling new technologies, materials, devices, and applications. This course will provide an introduction to nano-scale tribology and the critical role it plays in the developing areas of nanoscience and nanotechnology. We will discuss how contact, adhesion, friction, lubrication, and wear at interfaces originate, using an integrated approach that combines concepts of mechanics, materials science, chemistry, and physics. We will cover a range of concepts and applications, drawing connections to both established and new approaches. We will discuss the limits of continuum mechanics and present newly developed theories and experiments tailored to describe micro- and nano-scale phenomena. We will emphasize specific applications throughout the course. Reading of scientific literature, critical peer discussion, individual and team problem assignments, and a peer-reviewed literature research project will be assigned as part of the course.",University of Pennsylvania,"Philadelphia, Pennsylvania",nanotribology,3,Other,2,Topics
833,DATA 2080,Data and Society,"A course on the social, political, and philosophical issues raised by the theory and practice of data science. Explores how data science is transforming not only our sense of science and scientific knowledge, but our sense of ourselves and our communities and our commitments concerning human affairs and institutions generally. Students will examine the field of data science in light of perspectives provided by the philosophy of science and technology, the sociology of knowledge, and science studies, and explore the consequences of data science for life in the first half of the 21st century.",Brown,"Providence, Rhode Island ",society,12,Business,2,Topics
834,COMS E6998,NLP: Computational Models of Social Meaning,"1. Sentiment Analysis: automatic detection of people’s sentiment towards a topic, event, product, or persons. Practical applications in various domains will be discussed (e.g., predicting stock market prices, or presidential elections) 2. Emotion and Mood Analysis: automatic detection of people’s emotions (angry, sad, happy) by analyzing various media such as books, emails, lyrics, online discussion forums. Practical applications in various domains (such as predicting depression, categorization of songs) 3. Belief Analysis and Hedging: automatic detection of people’s beliefs (committed belief and non-committed beliefs) from social media. Analysis of the use of hedging as a communicative device in various media: online discussions, scientific writing or legal discussions. 4. Deception Detection (e.g., detecting fake reviews online, or deceptive speech in court proceedings) 5. Argumentation Mining: automatic detection of arguments from text, such as online discussion or persuasive essays. Practical application for various domains (e.g., political, legal or education (e.g., improving students’ skills in writing persuasive essays) 6. Social Power: automatic detection of power structure in organizations by analyzing people’s communications such as emails. 7. Extracting Social Networks from text, such as networks of characters from novels, or networks from social media (e.g., people holding particular opinions, or network of friends). 8. Personality and Interpersonal Stance",Columbia,"New York City, New York","nlp, meaning",3,Other,2,Topics
835,ITEC-620,Business Insights through Analytics,"Students are introduced to descriptive, predictive, and prescriptive analytics and to models, tools, and methods commonly used in each area to develop multidisciplinary business insights from data. They develop skills that enable them to present solutions to problems and provide answers to business questions in various business disciplines through hands-on exercises and a term project. The course emphasizes model development and the use of commercial software to manage, report, and analyze data. Grading: A-F only. Prerequisite:",American,"Washington, DC",business,12,Business,2,Topics
836,IDS 703,Data Scraping and Introduction to Text Analysis,"Introduction to the rich opportunities for using textual data produced by websites, social media platforms, digitization of administrative and historical records, and new monitoring technologies to gain insights and make decisions.",Duke,"Durham, North Carolina","scraping, introduction, analysis",2,Visualization,6,Visualization
837,625.25,Multivariable and Complex Analysis,"This course covers fundamental mathematical tools useful in all areas of applied mathematics, including statistics, data science, and differential equations. The course covers basic principles in linear algebra, multivariate calculus, and complex analysis. Within linear algebra, topics include matrices, systems of linear equations, determinants, matrix inverse, and eigenvalues/eigenvectors. Relative to multivariate calculus, the topics include vector differential calculus (gradient, divergence, curl) and vector integral calculus (line and double integrals, surface integrals, Green’s theorem, triple integrals, divergence theorem and Stokes’ theorem). For complex analysis, the course covers complex numbers and functions, conformal maps, complex integration, power series and Laurent series, and, time permitting, the residue integration method.",Johns Hopkins,"Baltimore, Maryland",analysis,3,Other,2,Topics
838,MSDS 464,DL Intelligent Systems and Robotics,"This course introduces reinforcement learning as an approach to intelligent systems, emphasizing applications such as robotic processes automation, conversational agents and robotics that mimic human behavior. Students implement intelligent agents to solve both discrete- and continuous-valued sequential decision-making problems. Students develop, debug, train, visualize, and customize programs in a variety of learning environments. The course reviews Markov decision processes, dynamic programming, temporal difference learning, Monte Carlo reinforcement learning, eligibility traces, the role of function approximation, and the integration of learning and planning. This is a case study and project-based course with a substantial programming component.",Northwestern,"Evanston, Illinois",,3,Other,2,Topics
839,BMIN-GA 3004,Next Generation Sequencing,This course provides practical training in informatics methods for analysis of next-generation DNA sequencing (NGS) data.,NYU,"New York City, New York",generation,3,Other,2,Topics
840,STAT 5101,Theory of Statistics I,"Logical development of probability, basic issues in statistics. Probability spaces. Random variables, their distributions and expected values. Law of large numbers, central limit theorem, generating functions, multivariate normal distribution.",University of Minnesota--Twin Cities,"Minneapolis, Minnesota ",theory,1,Software,7,Computer Science
841,EES 421,Quantitative Environmental Problem Solving,"This course provides an interdisciplinary, quantitative approach to environmental problems. Students develop a ""toolkit"" of quantitative methods and apply them to a variety of environmental questions. These tools include back-of-the-envelope estimation, dimensional analysis, box modeling, basic chemistry, and a system for detecting misleading information in maps, statistics, and graphical displays of information.",University of Rochester,"Rochester, New York",problem,3,Other,2,Topics
842,STAT 6210,Data Analysis,"Review of statistical principles of data analysis, using computerized statistical procedures. Multiple regression and the general linear model, analysis of contingency tables and categorical data, logistic regression for qualitative responses.",George Washington University,"Washington, DC",analysis,3,Other,2,Topics
843,PPUA 7237,Advanced Spatial Analysis of Urban Systems,"Builds on skills covered in PPUA 5263. Offers students an opportunity to obtain greater depth in the analysis of urban spatial data focused on several urban systems (including social, built, and natural systems). Focuses on understanding the spatial relationships between various new and large urban datasets relevant to current policy challenges within cities. This is a project-based class.",Northeastern,"Boston, Massachusetts",analysis,3,Other,2,Topics
844,MSDS 434,DL Analytics Application Engineering,"This course covers programming components essential to the development of analytics applications. The focus is analytics software engineering. Students learn to develop single-system/desktop solutions as well as client-server solutions. They learn about web-based, client-server solutions employing a variety of front-end and back-end system components. Students develop software, working on open-source programming, database, and systems integration projects. They employ best practices in software development.Â",Northwestern,"Evanston, Illinois","dl, application, engineering",7,Data Warehousing,5,Data Warehousing
845,ECE 442,Network Science Analytics,"The science of networks is an emerging discipline of great importance that combines graph theory, probability and statistics, and facets of engineering and the social sciences. This course will provide students with the mathematical tools and computational training to understand large-scale networks in the current era of Big Data. It will introduce basic network models and structural descriptors, network dynamics and prediction of processes evolving on graphs, modern algorithms for topology inference, community and anomaly detection, as well as fundamentals of social network analysis. All concepts and theories will be illustrated with numerous applications and case studies from technological, social, biological, and information networks.",University of Rochester,"Rochester, New York","network, science",11,Parallel Computing,8,HPC
846,625.662,Design and Analysis of Experiments,"Statistically designed experiments are the efficient allocation of resources to maximize the amount of information obtained with a minimum expenditure of time and effort. Design of experiments is applicable to both physical experimentation and computer simulation models. This course covers the principles of experimental design, the analysis of variance method, the difference between fixed and random effects and between nested and crossed effects, and the concept of confounded effects. The designs covered include completely random, randomized block, Latin squares, split-plot, factorial, fractional factorial, nested treatments and variance component analysis, response surface, optimal, Latin hypercube, and Taguchi. Any experiment can correctly be analyzed by learning how to construct the applicable design structure diagram (Hasse diagrams).",Johns Hopkins,"Baltimore, Maryland","design, analysis",3,Other,2,Topics
847,STATS 300A,Theory of Statistics I,"Finite sample optimality of statistical procedures; Decision theory: loss, risk, admissibility; Principles of data reduction: sufficiency, ancillarity, completeness; Statistical models: exponential families, group families, nonparametric families; Point estimation: optimal unbiased and equivariant estimation, Bayes estimation, minimax estimation; Hypothesis testing and confidence intervals: uniformly most powerful tests, uniformly most accurate confidence intervals, optimal unbiased and invariant tests.",Stanford,"Stanford, California ",theory,1,Software,7,Computer Science
848,PHYS 5116,Complex Networks and Applications,"Introduces network science and the set of analytical, numerical, and modeling tools used to understand complex networks emerging in nature and technology. Focuses on the empirical study of real networks, with examples coming from biology (metabolic, protein interaction networks), computer science (World Wide Web, Internet), or social systems (e-mail, friendship networks). Shows the organizing principles that govern the emergence of networks and the set of tools necessary to characterize and model them. Covers elements of graph theory, statistical physics, biology, and social science as they pertain to the understanding of complex systems.",Northeastern,"Boston, Massachusetts",,3,Other,2,Topics
849,PHTH 5202,Introduction to Epidemiology,"Introduces the principles, concepts, and methods of population-based epidemiologic research. Offers students an opportunity to understand and critically review epidemiologic studies. Lectures and discussions aim to serve as a foundation for training in epidemiology, quantitative methods, and population-based health research. The course is a required introductory course for students in the Master of Public Health program and is appropriate for students who are interested in epidemiologic research. Students not meeting course restrictions may seek permission of instructor.",Northeastern,"Boston, Massachusetts",introduction,2,Visualization,6,Visualization
850,BST 432,High Dimensional Data Analysis,"Application of statistical theory to the analysis of high throughput data; introduction to Bioconductor; molecular profiles (mRNA, cDNA, microRNA, proteomics); platforms (Affymetrix and other microarrays, PCR, RNA seq); quality control (quality assessment, batch-effects); exploratory methods (graphical methods, clustering, principal component analysis and other dimension reduction techniques); differential expression and multiple hypothesis testing; classification (feature selection, multivariate methods, machine learning, cross-validation).",University of Rochester,"Rochester, New York",analysis,3,Other,2,Topics
851,STAT 274,Theory of Interest,"Theory of interest, annuities, amortization, financial derivatives. Prepares for SOA Exam FM.",Brigham Young ,"Provo, Utah","theory, interest",1,Software,7,Computer Science
852,ENVS-660,Climatology,"This course investigates the physical and energetic exchange mechanisms within the atmosphere through time and space. Climate is examined by reconstructing the past and modeling future trends. Emphasis is placed on large-scale climate patterns, but the processes involved in storm front development also are explored. Topics covered include atmosphere-ocean interaction, wind circulation patterns, atmospheric water vapor and temperature, hurricane and tornado development, and the climate's impact on humans and their response to it. Crosslist:",American,"Washington, DC",climatology,3,Other,2,Topics
853,BMIN-GA 3003,Proteomics Informatics,"This course will give an introduction of proteomics and mass spectrometry workflows, experimental design, and data analysis with a focus on algorithms for extracting information from experimental data.",NYU,"New York City, New York",,3,Other,2,Topics
854,COMPSCI 630,Systems,"This class is an in-depth introduction to systems, focusing on principles of system design that cross-cut numerous systems artifacts, including operating systems, databases, runtime systems, and architecture. We will cover all levels of the ""system stack"", from chips to distributed systems. This class may be used to satisfy systems core requirements.",University of Massachusetts--Amherst,"Amherst, Massachusetts",,3,Other,2,Topics
855,COMPSCI 603,Robotics,"This course is intended to serve as an advanced overview of robotics spanning the complete autonomy loop: perception, planning, and control. We will study the theory, algorithms, andefficient implementations related to these topics, with a focus on open discussions for how to do research to go beyond the state of the art. Students will gain hands-on experience in implementing, and extending such algorithms using real robot data, as well as simulations.",University of Massachusetts--Amherst,"Amherst, Massachusetts",,3,Other,2,Topics
856,DS 6001,Practice and Application of Data Science,"This course covers the practice of data science practice, including communication, exploratory data analysis, and visualization. Also covered are the selection of algorithms to suit the problem to be solved, user needs, and data. Case studies will explore the impact of data science across different domains.",University of Virginia,"Charlottesville, Virginia","practice, application, science",3,Other,2,Topics
857,DS 6003,Practice and Application of Data Science II,"This course covers the practice of data science practice, including communication, exploratory data analysis, and visualization. Also covered are the selection of algorithms to suit the problem to be solved, user needs, and data. Students will use their capstone projects to explore the impact of data science on that domain.",University of Virginia,"Charlottesville, Virginia","practice, application, science, ii",3,Other,2,Topics
858,COMS E6998,Topics in Computer Science: Projects in Data Science: A First Course,"This course will introduce students to the practice of Data Science. Across many practice areas, Data Science is applied to generate knowledge and improve the quality of products and services. The form of this work can incorporate a wide variety of information sources, analytical methods, technological systems, and reporting formats. This course will provide exposure to the tools and techniques of Data Science while exploring a number of representative Practice Areas, Methods, and Software Skills",Columbia,"New York City, New York","computer, science, science, course",11,Parallel Computing,8,HPC
