,Course ID,Course Title,Course Description,University,Location,Course Title Stripped,Minor Cluster,Minor Cluster Name,Major Cluster,Major Cluster Name
233,GSND 6350,Data-Driven Player Modeling,"Introduces the topic of game analytics, defined as the process of discovering and communicating patterns in data with a goal of solving problems and developing predictions in user behavior supporting decision management, driving action, and/or improving game products. Covers the fundamental tools, methods, and principles of game analytics, including the knowledge-discovery process, data collection, feature extraction and selection, pattern recognition to aid in prediction and churn analysis, visualization, and reporting. Covers analytics across game forms, notably online games and delivery platforms. Presents analytical tools recommended during development and tools designed for ongoing maintenance of games.",Northeastern,"Boston, Massachusetts","player, modeling",9,Modeling,3,Statistics
234,MSDS 454,DL Advanced Modeling Techniques,"Drawing upon previous course work in data science, this course builds on earlier courses in analytics and modeling, providing an advanced review of traditional statistics and machine learning. It explores computer-intensive methods for parameter and error estimation, model selection, and model validation. Example topics include ordinary least squares regression, logistic regression, multinomial logistic regression, classification and regression trees, neural networks, support vector machines, naÃ¯ve Bayes methods, principal components analysis, cluster analysis, and regularization techniques. Students work on individual and team assignments using open-source programming tools.",Northwestern,"Evanston, Illinois",dl,3,Other,2,Topics
235,BIOL-GA 1131,Biophysical Modeling,"This course covers modeling of biological systems at multiple levels. The first part of the course begins with some basic molecular biology, including cooperative binding and simple induction of genes. A general approach to quantitative modeling of transcriptional regulation is developed and then applied to study small genetic circuits with feedback loops. Pattern formation and the mechanisms by which cells perceive spatial information from chemical signals are studied, and how biological systems can function robustly in the face of noise is investigated. In the second part of the course, cellular behaviors within heterogeneous populations are studied; also, population models are introduced (and relate the population models to the molecular/cellular models of the first part of the course). Diverse biological examples will be presented over the course of the semester to illustrate key concepts in modeling.",NYU,"New York City, New York",modeling,9,Modeling,3,Statistics
236,STATS 305A,Introduction to Statistical Modeling,"Statistics of real valued responses. Review of multivariate normal distribution theory. Univariate regression. Multiple regression. Constructing features from predictors. Geometry and algebra of least squares: subspaces, projections, normal equations, orthogonality, rank deficiency, Gauss-Markov. Gram-Schmidt, the QR decomposition and the SVD. Interpreting coefficients. Collinearity. Dependence and heteroscedasticity. Fits and the hat matrix. Model diagnostics. Model selection, Cp/AIC and crossvalidation, stepwise, lasso. Multiple comparisons. ANOVA, fixed and random effects. Use of bootstrap and permutations. Emphasis on problem sets involving substantive computations with data sets.",Stanford,"Stanford, California ","introduction, modeling",9,Modeling,3,Statistics
237,STAT 5400,Advanced Statistical Modeling,"Introduces methods, theory and applications of modern statistical models, from hierarchical linear models, to generalized hierarchical linear models, including hierarchical logistic and hierarchical count regression models. Topics such as estimation, residual diagnostics, goodness of fit, transformations, and various strategies for variable selection and model comparison will be discussed in depth. Examples will be demonstrated using statistical programming language R.",University of Colorado--Boulder,"Boulder, Colorado",modeling,9,Modeling,3,Statistics
238,CMSC625,Modeling and Simulation of Computer Systems,"Performance evaluation methods, Markovian queuing models, open networks of queues, closed product form queuing networks, simulation and measurement of computer systems, benchmarking and workload.",University of Maryland--College Park,"Adelphi, Maryland","modeling, simulation, computer",9,Modeling,3,Statistics
239,BE 567,Modeling Biological Systems,"This course will cover topics in systems biology at the molecular/cellular scale. The emphasis will be on quantitative aspects of molecular biology, with possible subjects including probabilistic aspects of DNA replication, transcription, translation, as well as gene regulatory networks and signaling. The class will involve analyzing and simulating models of biological behavior using MATLAB.",University of Pennsylvania,"Philadelphia, Pennsylvania",,3,Other,2,Topics
240,CIT 596,Molecular Modeling and Simulations,"This course focuses primarily on the design and analysis of algorithms. We will begin with sorting and searching algorithms and then spend most of the course on graph algorithms. In order to study graph algorithms, general algorithm design patterns like dynamic programming and greedy algorithms will be introduced. A section of this course is also devoted to understanding NP-Completeness",University of Pennsylvania,"Philadelphia, Pennsylvania",modeling,9,Modeling,3,Statistics
241,CS 573,Data Privacy and Security,"This course will introduce students to the legal and ethical issues of data privacy and security and computational technologies for protecting privacy and security while allowing society to collect and share person-specific data for many worthy purposes. The main topics include privacy and anonymity models, data anonymization, privacy preserving data mining, access control, secure computations, privacy in social networks and privacy in clinical and public health research. The foundations are drawn from a number of sub-disciplines of Computer Science including: database systems, data mining, computer security, cryptography, and statistics.",Emory,"Atlanta, Georgia ","privacy, security",1,Software,7,Computer Science
242,CS 546/547,Security/Privacy,"This course will cover both classic, foundational topics in computer security as well as recent developments. A key goal of the course will be to educate students to think both as an attacker and as a defender. The focus of the course will be security of computer systems, and will complement CS537, which focuses on distributed systems security.",Rutgers,"New Brunswick, New Jersey",security/privacy,1,Software,7,Computer Science
243,CSCI 8271,Security and Privacy in Computing,"Recent security/privacy issues in computer systems/networks. Threats, attacks, countermeasures. Security research, authentication, network security, wireless security, computer system security, anonymous system, pseudonym, access control, intrusion detection system, cryptographic protocols. How to pursue research in security and design secure systems.",University of Minnesota--Twin Cities,"Minneapolis, Minnesota ","security, privacy",1,Software,7,Computer Science
244,INF 529,Security and Privacy in Informatics,Covers societal implications of information privacy and how to design systems to best preserve privacy.,University of Southern California,"Los Angeles, California","security, privacy",1,Software,7,Computer Science
245,IST 769,Advanced Database Management,"This course provides an in-depth analysis of database management system architecture, building complex objects and applications using database forms and reports. Students learn about data warehousing, establishing and implementing database security, and tuning databases for optimum performance. Upon completion of this course, students will achieve a deep technical knowledge and comprehension of database management systems, management of solution development and management of information technology. Oracle 10g and Developer Suite 10g will be used for assignments, lab exercises and course projects.",Syracuse,"Syracuse, New York","database, management",7,Data Warehousing,5,Data Warehousing
246,STAT674,Applied Data Base Management,Provides an in-depth understanding of using computers to manage data using programs such as SAS and Microsoft/Access. May be offered concurrently with STAT 474.,University of Delaware,"Newark, Delaware","base, management",7,Data Warehousing,5,Data Warehousing
247,CS 525,Advanced Database Organization,"Comprehensive coverage of the problems involved in database system implementation and an in-depth examination of contemporary structures and techniques used in modern database management systems. Teaches advanced skills appropriate for DBMS architects and developers , database specialist, and the designers and developers of client/server and distributed systems. Focus is on transaction management, database structures and distributed processing.",Illinois Institute of Tech,"Chicago, Illinois ","database, organization",7,Data Warehousing,5,Data Warehousing
248,CS 425,Database Organization,"Overview of database architectures, including the Relational, Hierarchical, Network, and Object Models. Database interfaces, including the SQL query language. Database design using the Entity-Relationship Model. Issues such as security, integrity, and query optimization.",Illinois Institute of Tech,"Chicago, Illinois ","database, organization",7,Data Warehousing,5,Data Warehousing
249,CS 525,Advanced Database Organization,"Comprehensive coverage of the problems involved in database system implementation and an in-depth examination of contemporary structures and techniques used in modern database management systems. Teaches advanced skills appropriate for DBMS architects and developers , database specialist, and the designers and developers of client/server and distributed systems. Focus is on transaction management, database structures and distributed processing.",Illinois Institute of Tech,"Chicago, Illinois ","database, organization",7,Data Warehousing,5,Data Warehousing
250,SMU4,File Organization & Database Management,"In this course, students learn about current database approaches and systems, as well as the principles of design and the use of these systems. Students learn database query language design and implementation constraints as well as applications of large databases, including a survey of file structures and access techniques, such as NoSQL databases. Students will use a relational database management system to implement a database design project.",SMU,"Dallas, Texas","file, organization, database, management",7,Data Warehousing,5,Data Warehousing
251,EE 8367,Parallel Computer Organization,"Design/implementation of multiprocessor systems. Parallel machine organization, system design. Differences between parallel, uniprocessor machines. Programming models. Synchronization/communication. Topologies, message routing strategies. Performance optimization techniques. Compiler, system software issues.",University of Minnesota--Twin Cities,"Minneapolis, Minnesota ","computer, organization",0,Thesis,2,Topics
252,INF 551,Foundations of Data Management,"Function and design of modern storage systems, including cloud; data management techniques; data modeling; network attached storage, clusters and data centers; relational databases; the map-reduce paradigm.",University of Southern California,"Los Angeles, California",management,7,Data Warehousing,5,Data Warehousing
253,605.641,Principles of Database Systems,"This course examines the underlying concepts and theory of database management systems. Topics include database system architectures, data models, query languages, conceptual and logical database design, physical organization, and transaction management. The entity-relationship model and relational model are investigated in detail, object-oriented databases are introduced, and legacy systems based on the network and hierarchical models are briefly described. Mappings from the conceptual level to the logical level, integrity constraints, dependencies, and normalization are studied as a basis for formal design. Theoretical languages such as the relational algebra and the relational calculus are described, and high-level languages such as SQL and QBE are discussed. An overview of file organization and access methods is provided as a basis for discussion of heuristic query optimization techniques. Finally, transaction processing techniques are presented with a specific emphasis on concurrency control and database recovery.",Johns Hopkins,"Baltimore, Maryland",database,7,Data Warehousing,5,Data Warehousing
254,CS-GY 6083,Principles of Database Systems,"This course broadly introduces database systems, including the relational data model, query languages, database design, index and file structures, query processing and optimization, concurrency and recovery, transaction management and database design. Students acquire hands-on experience in working with database systems and in building web-accessible database applications.",NYU,"New York City, New York",database,7,Data Warehousing,5,Data Warehousing
255,IST 659,Data Administration Concepts and Database Administration,"This course provides a foundation for database administration, exploring the fundamental models of database management systems. It covers the definition, development and management of databases for information systems. Students learn data analysis techniques, data modeling, schema design, query languages and search specifications, including Structured Query Language (SQL), data structures, file organizations, principles of data management systems, and hierarchical, network and relational data models. Students gain hands-on experience using Microsoft’s Access and SQL Server database management systems (DBMS) as implementation vehicles. This course provides hands-on experience in database design and implementation through assignments, lab exercises and course projects. This course also introduces advanced database concepts such as transaction management and concurrency control, distributed databases, multitier client/server architectures, web-based database applications, data warehousing and NoSQL.",Syracuse,"Syracuse, New York","administration, database, administration",7,Data Warehousing,5,Data Warehousing
256,CSCI 5707,Principles of Database Systems,"Concepts, database architecture, alternative conceptual data models, foundations of data manipulation/analysis, logical data models, database designs, models of database security/integrity, current trends.",University of Minnesota--Twin Cities,"Minneapolis, Minnesota ",database,7,Data Warehousing,5,Data Warehousing
257,DATASCI W205,Fundamentals of Data Engineering,"Storing, managing, and processing datasets are foundational processes in data science. This course introduces the fundamental knowledge and skills of data engineering that are required to be effective as a data scientist. This course focuses on the basics of data pipelines, data pipeline flows and associated business use cases, and how organizations derive value from data and data engineering. As these fundamentals of data engineering are introduced, learners will interact with data and data processes at various stages in the pipeline, understand key data engineering tools and platforms, and use and connect critical technologies through which one can construct storage and processing architectures that underpin data science applications.",UC Berkeley,"Berkeley, California ",engineering,7,Data Warehousing,5,Data Warehousing
258,DATA 504,Databases and Large Data Repositories,"The focus of this course is on understanding information systems and infrastructure used in Data Analytics. The course will provide an introduction to elements of database design and database query languages. Students will also gain technical understanding of and hands-on experience with the information technology infrastructure required for data analytics. The first part of the course focuses on traditional databases and structured data. It covers association between data elements and data models (including entity-relationship and relational models), relational database design techniques and database query languages. Students will be exposed to the basics in query processing, transaction management and concurrency control. The second part of the course covers non-relational databases and big data infrastructure. Students compare and contrast and gain hands-on experience with various non-relational databases including document, graph and column databases. Students will also be exposed to Hadoop environment and basic services available in this environment, distributed file systems, storage and processing.",Binghamton,"Binghamton, New York",,3,Other,2,Topics
259,BIOL-GA 1009,Biological Databases and Datamining,"The course is divided into three sections: 1) Introduction to MySQL and R. 2) Introduction to different data types, and 3) Machine learning methods for data mining. Students will learn to create their own database using MySQL and SQLite containing different types of biological data. Students will also learn to mine the heterogeneous biological data using machine-learning methods such as Support Vector Machines and Multiple Regressions. We will apply these methods on experimental data in order to classify and prediction gene function and regulation.",NYU,"New York City, New York",,3,Other,2,Topics
260,CS 539,Databases,"This course focuses on the implementation of data management systems. It builds upon knowledge gathered in 198:336 (or a similar Introduction to Databases course), and provides students the tools to understand the internals of a DBMS. In particular, we will cover transaction management, query processing and query optimization in details. We will also discuss the implementation of systems handling text data as well as data management issues in a web context.",Rutgers,"New Brunswick, New Jersey",,3,Other,2,Topics
261,CSCI 8725,Databases for Bioinformatics,"DBMS support for biological databases, data models. Searching integrated public domain databases. Queries/analyses, DBMS extensions, emerging applications.",University of Minnesota--Twin Cities,"Minneapolis, Minnesota ",,3,Other,2,Topics
262,UND 1,DATABASES & DATA SECURITY,"Calibrated to data science applications, this course focuses on effective techniques in managing, ingesting, retrieving and updating information from a database system. It provides an introduction to relational databases, including topics such as relational calculus and algebra, integrity constraints, distributed databases, and data security. Students are introduced to database technologies, such as NoSQL, graph databases, in-memory databases, querying data over HDFS (Hive), etc. A final project consists of the integration of a database system into an analytics workflow",University of Notre Dame,"Notre Dame, Indiana",security,1,Software,7,Computer Science
263,CIS 550,Databases,"This course provides an introduction to the broad field of database and information systems, covering a variety of topicsrelating to structured data, ranging from data modeling to logical foundationsand popular languages, to system implementations. Wewill study the theory ofrelational and XML data design; the basics of query languages; efficientstorage of data, execution of queries and query optimization; transactions andupdates; web-database development; and ""big data"" and NoSQL systems.",University of Pennsylvania,"Philadelphia, Pennsylvania",,3,Other,2,Topics
264,MSDS691,Relational Databases,"An introduction to relational databases focusing on learning SQL with the Postgres database. Topics include schemas (tables in various normal forms), indexes, query efficiency, server-specific navigation functions, and queries with grouping, ordering, sorting, collapsing, and joins.",University of San Francisco,"San Francisco, California",,3,Other,2,Topics
265,DATS 6102,Data Warehousing,"Fundamentals and practical applications of data warehousing, including planning requirements, infrastructure, design, and maintenance.",George Washington University,"Washington, DC",,3,Other,2,Topics
266,IST 722,Data Warehousing,"This course introduces the concepts of business intelligence (BI) and the practice/techniques in building a BI solution. Students focus on how to use data warehouses as a BI solution to make better organizational decisions. Topics include concepts, principles and tools for designing, and implementing data warehouses. Students learn the differences between Ralph Kimball’s and Bill Inmon’s approaches, roles and responsibilities in the design and implementation of a data warehouse, project management guidelines and techniques, and requirements gathering. Coursework also covers dimensional modeling, Extract Transform and Load (ETL) architecture, specification and data loading, and master and reference data management, as well as integration approaches (ETL, EII, EAI), analytical reporting concepts, data governance and recent trends in the data warehouse domain.",Syracuse,"Syracuse, New York",,3,Other,2,Topics
267,IS733,Data Warehousing and Data Mining,"The purpose of this course is to provide a comprehensive discussion of using organizational databases to enable decision support through mining data. This course will provide an in-depth understanding of the technical, business and research issues in the area of data mining. Areas of data mining will include justifying the need for knowledge recovery in databases and data mining methods such as clustering, classification, Bayesian networks, association rules and visualization. The course will provide a brief introduction to issues in data warehousing which include designing multi-dimensional data models; cleansing and loading of data; reporting; ad hoc querying and multi-dimensional operations, such as slicing, dicing, pivoting, drill-down and roll-up operations. New areas of research and development in data mining will also be discussed.",University of Maryland--College Park,"Adelphi, Maryland","warehousing, mining",10,Data Mining,1,Data Mining
268,CSC-634,Database Management Systems,"Examination of database management systems, distributed systems, evaluation and selection of computer systems, privacy and security, and performance evaluation. This course provides a fundamental exposure to relational architecture through exercises in Microsoft Access and Oracle 8, including an introduction to SQL. Crosslist:",American,"Washington, DC","database, management",7,Data Warehousing,5,Data Warehousing
269,COMPSCI 516,Database Systems,"Principles and techniques for making intelligent use of the massive amounts of data generated in commerce, industry, science, and society. Topics include basic concepts in databases (SQL, relational algebra, relational calculus, normal forms), indexing and hashing, query processing and query optimizations, transactions (concurrency control and recovery), parallel and distributed data processing, NOSQL and column store, and selected advanced topics (e.g. Datalog, cloud computing fault-tolerant / self-tuning data management, Web information retrieval/extraction, data warehouse, OLAP, data mining). Prerequisites: Computer Science 316 or an introductory database course or consent of instructor.",Duke,"Durham, North Carolina",database,7,Data Warehousing,5,Data Warehousing
270,CS 554,Database Systems,"This course covers tabular data storage and processing using the classic SQL language, query processing and optimization algorithms. Novel data formats are explored emphasizing commonly used key-value, document, RDF and graph representations. Storage and processing techniques for large quantity of data are presented.",Emory,"Atlanta, Georgia ",database,7,Data Warehousing,5,Data Warehousing
271,605.741,Large-Scale Database Systems,"This course investigates the theory and practice of modern large-scale database systems. Large-scale approaches include distributed relational databases; data warehouses; and the Hadoop ecosystem (Hadoop, Accumulo, and the Mahout machine learning libraries). Topics discussed include data design and architecture; database security, integrity, query processing, query optimization, transaction management, concurrency control, and fault tolerance; and query formulation, algorithms, and cloud analytics. At the end of the course, students will understand the principles of several common large-scale data systems including their architecture, performance, and costs. Students will also gain a sense of which approach is recommended for different circumstances.",Johns Hopkins,"Baltimore, Maryland",database,7,Data Warehousing,5,Data Warehousing
272,MSDS 420,DL Database Systems and Data Preparation,"In this course, students explore the fundamental concepts of database management and data preparation. With a focus on applications in large-scale data analytics projects, the course introduces relational database systems, the relational model, normalization process, and structured query language (SQL). The course discusses topics related to data integration and cleaning, database programming for extract, transform, and load (ETL) operations. Students learn NoSQL technologies for working with unstructured data and document-oriented information retrieval systems. They learn how to index and score documents for effective and relevant responses to user queries. Students acquire hands-on programming experience for data preparation and data extraction using various data sources and file formats.",Northwestern,"Evanston, Illinois","database, preparation",7,Data Warehousing,5,Data Warehousing
