,Course ID,Course Title,Course Description,University,Location,Course Title Stripped,Minor Cluster,Minor Cluster Name,Major Cluster,Major Cluster Name
532,CS 6120,Natural Language Processing,"Provides an introduction to the computational modeling of human language, the ongoing effort to create computer programs that can communicate with people in natural language, and current applications of the natural language field, such as automated document classification, intelligent query processing, and information extraction. Topics include computational models of grammar and automatic parsing, statistical language models and the analysis of large text corpuses, natural language semantics and programs that understand language, models of discourse structure, and language use by intelligent agents. Course work includes formal and mathematical analysis of language models, and implementation of working programs that analyze and interpret natural language text.",Northeastern,"Boston, Massachusetts","language, processing",8,NLP,4,Machine Learning
533,MSDS 453,DL Natural Language Processing,"A comprehensive review of text analytics and natural language processing with a focus on recent developments in computational linguistics and machine learning. Students work with unstructured and semi-structured text from online sources, document collections, and databases. Using methods of artificial intelligence and machine learning, students learn how to parse text into numeric vectors and to convert higher dimensional vectors into lower dimensional vectors for subsequent analysis and modeling. Applications include speech recognition, semantic processing, text classification, relevant search, recommendation systems, sentiment analysis, and topic modeling. This is a project-based course with extensive programming assignments.",Northwestern,"Evanston, Illinois","language, processing",8,NLP,4,Machine Learning
534,MSDS 453,DL Natural Language Processing,"A comprehensive review of text analytics and natural language processing with a focus on recent developments in computational linguistics and machine learning. Students work with unstructured and semi-structured text from online sources, document collections, and databases. Using methods of artificial intelligence and machine learning, students learn how to parse text into numeric vectors and to convert higher dimensional vectors into lower dimensional vectors for subsequent analysis and modeling. Applications include speech recognition, semantic processing, text classification, relevant search, recommendation systems, sentiment analysis, and topic modeling. This is a project-based course with extensive programming assignments.",Northwestern,"Evanston, Illinois","language, processing",8,NLP,4,Machine Learning
535,DS-GA 1011,Natural Language Processing with Representation Learning,"How should human languages be understood and analyzed? This course examines modern computational approaches based on representation learning for understanding, processing and using human language. These include neural network-based deep learning methods and vector-space models of word meaning, and together will give the tools to build state-of-the-art models for hard language understanding tasks like translation.",NYU,"New York City, New York","language, processing, representation, learning",5,Deep Learning,4,Machine Learning
536,DS-GA 1012,Natural Language Understanding and Computational Semantics,"Since at least the proposal of the Turing test, building computational systems that can communicate with humans using natural language has been a central goal for Al research. Understanding real, naturally occurring human language is the key to reaching this goal. This course surveys recent successes in language understanding and prepares students to do original research in this area, culminating with a substantial final project. The course will focus on text, but within that will touch on the full range of applicable techniques for language understanding, including formal logics, statistical methods, distributional methods, and deep learning, and will bring in ideas from formal linguistics where they can be readily used in practice. We'll discuss tasks like sentiment analysis, word similarity, and question answering, as well as higher level issues like how to effectively represent language meaning.",NYU,"New York City, New York","language, understanding",8,NLP,4,Machine Learning
537,SMU14,Natural Language Processing,"In this course, students are introduced to natural language processing as it applies to data mining, text mining and machine learning tasks with unstructured big data. Students will receive a broad survey of the major tasks in natural language understanding, with some coverage of natural language generation. Topics include document clustering and classification, automated tagging and highlighting, semantic search and text normalization to support machine learning applications. The focus is on best practices for choosing the right tool and method for an application, illustrated with real-world case studies. Students will gain experience building solutions from real-world data sets, utilizing WordNet and the data of some leading websites.",SMU,"Dallas, Texas","language, processing",8,NLP,4,Machine Learning
538,IST 664,Natural Language Processing,"This course focuses on the linguistic and computational aspects of natural language processing (NLP) technologies. Students develop an understanding of how NLP can process written text and produce a linguistic analysis that can be used in other applications. Discussions cover the multiple levels of linguistic analysis required for a computer to accept natural language input, interpret it and carry out a particular application. Topics include levels of linguistic analysis with a focus on techniques in application. Students in this course will explore all the levels of linguistic analysis, going from tokenization, word-level semantics, part-of-speech tagging, syntax and semantics up to the discourse level. They will also use NLP techniques on unstructured data using Python, including information retrieval, question-answering, sentiment analysis, summarization and dialogue systems.",Syracuse,"Syracuse, New York","language, processing",8,NLP,4,Machine Learning
539,COMPSCI 585,Introduction to Natural Language Processing,"Natural Language Processing (NLP) is the engineering art and science of how to teach computers to understand human language. NLP is a type of artificial intelligence technology, and it's now ubiquitous -- NLP lets us talk to our phones, use the web to answer questions, map out discussions in books and social media, and even translate between human languages. Since language is rich, subtle, ambiguous, and very difficult for computers to understand, these systems can sometimes seem like magic -- but these are engineering problems we can tackle with data, math, machine learning, and insights from linguistics. This course will introduce NLP methods and applications including probabilistic language models, machine translation, and parsing algorithms for syntax and the deeper meaning of text. During the course, students will (1) learn and derive mathematical models and algorithms for NLP; (2) become familiar with basic facts about human language that motivate them, and help practitioners know what problems are possible to solve; and (3) complete a series of hands-on projects to implement, experiment with, and improve NLP models, gaining practical skills for natural language systems engineering.",University of Massachusetts--Amherst,"Amherst, Massachusetts","introduction, language, processing",8,NLP,4,Machine Learning
540,CSC 447,Natural Language Processing,"An introduction to natural language processing: constructing computer programs that understand natural language. Topics include parsing, semantic analysis, and knowledge representation. CSC 447, a graduate-level course, requires additional readings and assignments.",University of Rochester,"Rochester, New York","language, processing",8,NLP,4,Machine Learning
541,CSCI 544,Applied Natural Language Processing,"Introduction to key components of human language technologies, including: information extraction, sentiment analysis, question answering, machine translation.",University of Southern California,"Los Angeles, California","language, processing",8,NLP,4,Machine Learning
542,CME 342,Parallel Methods in Numerical Analysis,"Emphasis is on techniques for obtaining maximum parallelism in numerical algorithms, especially those occurring when solving matrix problems, partial differential equations, and the subsequent mapping onto the computer. Implementation issues on parallel computers. Topics: parallel architecture, programming models (MPI, GPU Computing with CUDA ¿ quick review), matrix computations, FFT, fast multiple methods, domain decomposition, graph partitioning, discrete algorithms. Prerequisites: 302 or 200 (ME 300A), 213 or equivalent, or consent of instructor. Recommended: differential equations and knowledge of a high-level programming language such as C or C++ (F90/95 also allowable).",Stanford,"Stanford, California ",analysis,3,Other,2,Topics
543,MATH 126,Numerical Analysis,"Analysis of algorithms involving computation with real numbers. Interpolation, methods for solving linear and nonlinear systems of equations, numerical integration, numerical methods for solving ordinary differential equations.",Tufts,"Medford, Massachusetts",analysis,3,Other,2,Topics
544,EAS 501,Introduction to Numerical Mathematics for Computing and Data Scientists,"The aim of this course is to develop the ability to formulate and solve problems using mathematical methods and tools. To apply knowledge gained in lower level mathematics courses. To introduce concepts and methods of linear algebra. To introduce a broad range of numerical methods. To develop an ability to identify, understand, and solve algebraic equations. To develop an ability to identify, understand, and solve differential equations. To develop experience with numerical and symbolic mathematical software and their use in problem solving",University at Buffalo,"Buffalo, New York",introduction,2,Visualization,6,Visualization
545,CSCI 5302,Analysis of Numerical Algorithms,"Additional topics in numerical analysis. Interpolation, approximation, extrapolation, numerical integration/differentiation, numerical solutions of ordinary differential equations. Introduction to optimization techniques.",University of Minnesota--Twin Cities,"Minneapolis, Minnesota ","analysis, algorithm",4,Algorithms,0,Math
546,MATH 535,Optimization I,"Introduction to both theoretical and algorithmic aspects of linear optimization: geometry of linear programs, simplex method, anticycling, duality theory and dual simplex method, sensitivity analysis, large scale optimization via Dantzig-Wolfe decomposition and Benders decomposition, interior point methods, network flow problems, integer programming. Credit may not be given for both MATH 435 and MATH 535.",Illinois Institute of Tech,"Chicago, Illinois ","optimization, i",4,Algorithms,0,Math
547,625.615,Introduction to Optimization,"This course introduces applications and algorithms for linear, network, integer, and nonlinear optimization. Topics include the primal and dual simplex methods, network flow algorithms, branch and bound, interior point methods, Newton and quasi-Newton methods, and heuristic methods. Students will gain experience in formulating models and implementing algorithms using MATLAB. No previous experience with the software is required.",Johns Hopkins,"Baltimore, Maryland","introduction, optimization",4,Algorithms,0,Math
548,625.743,Stochastic Optimization and Control,"Stochastic optimization plays a large role in modern learning algorithms and in the analysis and control of modern systems. This course introduces the fundamental issues in stochastic search and optimization, with special emphasis on cases where classical deterministic search techniques (steepest descent, Newton–Raphson, linear and nonlinear programming, etc.) do not readily apply. These cases include many important practical problems in engineering, computer science, machine learning, and elsewhere, which will be briefly discussed throughout the course. Discrete and continuous optimization problems will be considered. Algorithms for global and local optimization problems will be discussed. Methods such as random search, least mean squares (LMS), stochastic approximation, stochastic gradient, simulated annealing, evolutionary computation (including genetic algorithms), and stochastic discrete optimization will be discussed.",Johns Hopkins,"Baltimore, Maryland","optimization, control",4,Algorithms,0,Math
549,EECE 7360,Combinatorial Optimization,"Introduces combinatorial optimization, an emerging field that combines techniques from applied mathematics, operations research, and computer science to solve optimization problems over discrete structures. Emphasizes problems that arise in the areas of electrical and computer engineering including VLSI, computer-aided design, parallel computing, computer architecture, and high-performance compiling. Covers the foundations of algorithm analysis including asymptotic notation and complexity theory, and a range of optimization techniques including divide and conquer, local optimization, dynamic programming, branch and bound, simulated annealing, genetic algorithms, approximation algorithms, integer and linear programming, matroid theory, and greedy algorithms. Considers the efficient generation of optimal solutions, the development and evaluation of heuristics, and the computation of tight upper and lower bounds.",Northeastern,"Boston, Massachusetts",optimization,4,Algorithms,0,Math
550,DS-GA 1013,Optimization-based Data Analysis,"This course provides a rigorous introduction to mathematical tools for data science drawn from linear algebra, harmonic analysis, probability theory, and convex analysis. The main topics are the singular-value decomposition (SVD), the Fourier series, randomized projections, the randomized SVD, convex optimization, duality theory and nonconvex optimization. The material is motivated by multiple data-analysis applications including dimensionality reduction, collaborative filtering, sound and image processing, magnetic-resonance imaging, sparse regression, compressed sensing, and topic modeling.",NYU,"New York City, New York",analysis,3,Other,2,Topics
551,CSCI-GA 2945,Convex and Nonsmooth Optimization,"Topics in convex optimization that will be covered include duality, linear and semidefinite programming, CVX (""disciplined convex programming""), gradient and Newton methods, Nesterov's complexity bound, the alternating direction method of multipliers, the nuclear norm and matrix completion, the primal barrier method, primal-dual interior-point methods for linear and semidefinite programs. Topics in nonsmooth optimization that will be covered include subgradients and subdifferentials, Clarke regularity, and algorithms, including gradient sampling and BFGS, for nonsmooth, nonconvex optimization.",NYU,"New York City, New York","convex, optimization",4,Algorithms,0,Math
552,CS 521,Linear Programming/Optimization,"Linear programming problems, the simplex method, duality theory, sensitivity analysis, introduction to integer programming, the transportation problem, network flows, and other applications.",Rutgers,"New Brunswick, New Jersey",programming/optimization,14,,,
553,CME 307,Optimization,"Applications, theories, and algorithms for finite-dimensional linear and nonlinear optimization problems with continuous variables. Elements of convex analysis, first- and second-order optimality conditions, sensitivity and duality. Algorithms for unconstrained optimization, and linearly and nonlinearly constrained problems. Modern applications in communication, game theory, auction, and economics.",Stanford,"Stanford, California ",optimization,4,Algorithms,0,Math
554,CME 323,Distributed Algorithms and Optimization,"The emergence of clusters of commodity machines with parallel processing units has brought with it a slew of new algorithms and tools. Many fields such as Machine Learning and Optimization have adapted their algorithms to handle such clusters. Topics include distributed and parallel algorithms for: Optimization, Numerical Linear Algebra, Machine Learning, Graph analysis, Streaming algorithms, and other problems that are challenging to scale on a commodity cluster. The class will focus on analyzing parallel and distributed programs, with some implementation using Apache Spark and TensorFlow.",Stanford,"Stanford, California ","algorithm, optimization",4,Algorithms,0,Math
555,MA 630,Advanced Optimization Methods,"The objective of this course is to introduce the students to the most popular numerical methods for solving nonlinear and non-smooth optimization problems. The techniques will be based on the properties of nonlinear non-smooth optimization models and optimality conditions. Linear optimization techniques will be treated as a special case. Some emphasis will be put on using optimization software. Examples using AMPL and CPLEX will be demonstrated in class. Topics include line search, non-derivative methods, basic decent methods, conjugate gradient methods, subgradient methods, Newton methods, projection methods, penalty, barrier, interior point methods, Lagrangian methods, bundle methods, trust-region method, numerical treatment of non-convex models, and decomposition methods.",Stevens IT,"Hoboken, New Jersey",optimization,4,Algorithms,0,Math
556,EE 109,Convex Optimization,"Convex optimization theory and algorithms. Convex sets, convex functions and convex optimization problems; duality theory and optimality conditions; algorithms for solving convex problems including descent, gradient descent, Newton and interior point methods. Examples of application taken from communications, signal processing and other fields. Project.",Tufts,"Medford, Massachusetts","convex, optimization",4,Algorithms,0,Math
557,ECE 273,Convex Optimization and Applications,"This course covers some convex optimization theory and algorithms. It will mainly focus on recognizing and formulating convex problems, duality, and applications in a variety of fields (system design, pattern recognition, combinatorial optimization, financial engineering, etc.).",UCSD,"San Diego, California","convex, optimization",4,Algorithms,0,Math
558,MATH612,Solving Linear Equations and Optimization,"LU and QR factorizations, singular value and eigenvalue decompositions, matrix conditioning, solution of linear systems and linear least-squares problems, iterative methods in linear algebra, descent and quasi-Newton methods of optimization, globalizing convergence, constrained optimization, applications.",University of Delaware,"Newark, Delaware",optimization,4,Algorithms,0,Math
559,EE 5239,Introduction to Nonlinear Optimization,"Nonlinear optimization. Analytical/computational methods. Constrained optimization methods. Convex analysis, Lagrangian relaxation, non-differentiable optimization, applications in integer programming. Optimality conditions, Lagrange multiplier theory, duality theory. Control, communications, management science applications.",University of Minnesota--Twin Cities,"Minneapolis, Minnesota ","introduction, optimization",4,Algorithms,0,Math
560,EE 8231,Optimization Theory,"Introduction to optimization in engineering; approximation theory. Least squares estimation, optimal control theory, and computational approaches.",University of Minnesota--Twin Cities,"Minneapolis, Minnesota ","optimization, theory",1,Software,7,Computer Science
561,IE 5531,Engineering Optimization I,"Linear programming, simplex method, duality theory, sensitivity analysis, interior point methods, integer programming, branch/bound/dynamic programming. Emphasizes applications in production/logistics, including resource allocation, transportation, facility location, networks/flows, scheduling, production planning.",University of Minnesota--Twin Cities,"Minneapolis, Minnesota ","engineering, optimization, i",7,Data Warehousing,5,Data Warehousing
562,PHYS 440,Computational Physics,"Root finding using the Newton-Raphson method; interpolation using Cubic Splines and Least Square Fitting; solving ordinary differential equations using Runge-Kutta and partial differential equations using Finite Difference and Finite Element techniques; numerical quadrature using Simpson's Rule, Gaussian Quadrature and the Monte Carlo method; and spectral analysis using Fast Fourier Transforms. These techniques are applied to a wide range of physics problems such as finding the energy levels of a finite quantum well using a root finding technique, solving the Schrodinger equation using the Runge-Kutta-Fehlberg method, using random numbers to simulate stochastic processes such as a random walk, using the Fast Fourier Transform method to perform a spectral analysis on non-linear chaotic systems such as the Duffing oscillator, and using auto-correlation functions to simulate sonar or radar ranging problems.",Illinois Institute of Tech,"Chicago, Illinois ",,3,Other,2,Topics
563,PHYS 7305,Statistical Physics,"Briefly reviews thermodynamics. Topics include the principles of statistical mechanics and statistical thermodynamics; density matrix; theory of ensembles; Fermi-Dirac and Bose-Einstein statistics, application to gases, liquids, and solids; theory of phase transitions; and thermodynamics of electric and magnetic systems, transport phenomena, random walks, and cooperative phenomena.",Northeastern,"Boston, Massachusetts",,3,Other,2,Topics
564,PHYS 7321,Computational Physics,"Covers basic numerical methods for differentiation, integration, and matrix operations used in linear algebra problems, discrete Fourier transforms, and standard and stochastic ordinary and partial differential equations. Specific applications of these methods may include classical chaos, computation of eigenstates of simple quantum systems, classical phase transitions, boundary value problems, pattern formation, and molecular dynamics and classical/quantum Monte Carlo methods to simulate the equilibrium and nonequilibrium properties of condensed phases.",Northeastern,"Boston, Massachusetts",,3,Other,2,Topics
565,PHYS-GA 2000,Computational Physics,"Emphasis is on current research where numerical techniques provide unique physical insight. Applications include, among others, solution of differential equations, eigenvalue problems, statistical mechanics, field theory, and chaos.",NYU,"New York City, New York",,3,Other,2,Topics
566,PHYS-GA 2002,Statistical Physics,"Introduction, with representative applications. Review of thermodynamics; Gibbs ensembles for equilibrium; application to ideal gases, condensed phases of matter, and radiation; fluctuations and noise, kinetic theory.",NYU,"New York City, New York",,3,Other,2,Topics
567,GOVT-650,Political Analysis,"Methods of scientific analysis, including research formulation, hypothesis generation and testing, quantitative analysis, and computer techniques. Usually Offered: fall.",American,"Washington, DC",analysis,3,Other,2,Topics
568,GOVT-653,Introduction to Quantitative Methods in Political Science,Application of techniques of bivariate analysis to measurement of political behavior; emphasis on techniques relevant for political scientists and students of public administration.,American,"Washington, DC","introduction, science",2,Visualization,6,Visualization
569,PUAD-672,Advanced Quantitative Methods for Policy Analysis,"This course applies advanced econometric techniques to policy analysis. The course covers extensions to the linear regression model, including instrumental variables and panel-data methods, as well as introduction to the estimation and interpretation of nonlinear regression models, such as those for limited dependent variables, quantile regression, sample-selection corrections, and survival analysis. Usually Offered: fall. Grading: A-F only. Prerequisite:",American,"Washington, DC","policy, analysis",12,Business,2,Topics
570,POLSCI 748,Advanced Quantitative Research Methods in Political Science,"Theory and practice of causal inference in the social sciences, introduces basic concepts, such as counterfactuals and identification. Introduces the formal frameworks of potential outcomes and graphical models (DAGs). Covers experiments (in the lab and the field), and various regression-based approaches.",Duke,"Durham, North Carolina","research, science",0,Thesis,2,Topics
571,DATA 510,Analytics Practicum I,"This course teaches data analytics within a problem-solving framework. In doing so, students are provided a unique opportunity to apply the analytical tools and concepts taught in the program in a practical manner. Students will work on live projects from various organizations. Each project will have three to five students assembled as a team. Each project involves a single ""client"" organization, which may be a profit, non-profit or governmental organization. Each client provides its assigned study team with a project of current interest and an executive dedicated to working with the team. A faculty advisor is assigned to each team. Several faculty advisors might participate, depending on the expertise needed. Students schedule their own time, dovetailing with client schedules and that of their faculty advisor. Students (in consultation with the client and faculty advisor) will be responsible for project scope, understanding the issues and analytic needs, identifying appropriate analytical methods, analyzing the data, drawing conclusions, making recommendations for decision-making, writing a report and presenting conclusions/recommendations to the clients and to the advisor/instructor.",Binghamton,"Binghamton, New York",i,3,Other,2,Topics
