,Course ID,Course Title,Course Description,University,Location,Course Title Stripped,Minor Cluster,Minor Cluster Name,Major Cluster,Major Cluster Name
0,COMPSCI 532,Design and Analysis of Algorithms,"Design and analysis of efficient algorithms. Algorithmic paradigms. Applications include sorting, searching, dynamic structures, graph algorithms, randomized algorithms. Computationally hard problems. NP completeness. Prerequisites: Computer Science 201 and 330 or equivalent.",Duke,"Durham, North Carolina","design, analysis, algorithm",4,Algorithms,0,Math
1,CS 535,Design and Analysis of Algorithms,"Design of efficient algorithms for a variety of problems, with mathematical proof of correctness and analysis of time and space requirements. Topics include lower bounds for sorting and medians, amortized analysis of advanced data structures, graph algorithms (strongly connected components, shortest paths, minimum spanning trees, maximum flows and bipartite matching) and NP-Completeness.",Illinois Institute of Tech,"Chicago, Illinois ","design, analysis, algorithm",4,Algorithms,0,Math
2,EC EGNR 232E,Large-Scale Social and Complex Networks: Design and Algorithms,"Modeling and design of large-scale complex networks, including social networks, peer-to-peer file-sharing networks, World Wide Web, and gene networks. Modeling of characteristic topological features of complex networks, such as power laws and percolation threshold. Mining topology to design algorithms for various applications, such as e-mail spam detection, friendship recommendations, viral popularity, and epidemics. Introduction to network algorithms, computational complexity, and nondeterministic, polynomial-time completeness.",UCLA,"Los Angeles, California","design, algorithm",4,Algorithms,0,Math
3,CSC 482,Design & Analysis of Efficient Algorithms,"How does one design programs and ascertain their efficiency? Divide-and-conquer techniques, string processing, graph algorithms, mathematical algorithms. Advanced data structures such as balanced tree schemes. Introduction to NP-completeness and intractable combinatorial search, optimization, and decision problems.",University of Rochester,"Rochester, New York","design, analysis, algorithm",4,Algorithms,0,Math
4,CS 526,Algorithms,"This course is a graduate level introduction to the design and analysis of algorithms. Although we will review some undergraduate level material, we will instead emphasize reading and experimentation at a level appropriate for the initiation of research. This course will have both theoretical and practical content. As course highlights, students will be expected to implement and analyze the performance of a fundamental data structure, starting with a close reading of the original research paper.",Emory,"Atlanta, Georgia ",algorithm,4,Algorithms,0,Math
5,CS 430,Introduction to Algorithms,"Introduction to the design, behavior, and analysis of computer algorithms. Searching, sorting, and combinatorial algorithms are emphasized. Worst case, amortized, and expected bounds on time and space usage.",Illinois Institute of Tech,"Chicago, Illinois ",introduction,2,Visualization,6,Visualization
6,CS 5800,Algorithms,"Presents the mathematical techniques used for the design and analysis of computer algorithms. Focuses on algorithmic design paradigms and techniques for analyzing the correctness, time, and space complexity of algorithms. Topics may include asymptotic notation, recurrences, loop invariants, Hoare triples, sorting and searching, advanced data structures, lower bounds, hashing, greedy algorithms, dynamic programming, graph algorithms, and NP-completeness.",Northeastern,"Boston, Massachusetts",algorithm,4,Algorithms,0,Math
7,CME 309,Randomized Algorithms and Probabilistic Analysis,"Randomness pervades the natural processes around us, from the formation of networks, to genetic recombination, to quantum physics. Randomness is also a powerful tool that can be leveraged to create algorithms and data structures which, in many cases, are more efficient and simpler than their deterministic counterparts. This course covers the key tools of probabilistic analysis, and application of these tools to understand the behaviors of random processes and algorithms. Emphasis is on theoretical foundations, though we will apply this theory broadly, discussing applications in machine learning and data analysis, networking, and systems. Topics include tail bounds, the probabilistic method, Markov chains, and martingales, with applications to analyzing random graphs, metric embeddings, random walks, and a host of powerful and elegant randomized algorithms.",Stanford,"Stanford, California ","algorithm, analysis",4,Algorithms,0,Math
8,COMP 160,Algorithms,"Introduction to the study of algorithms. Strategies such as divide-and-conquer, greedy methods, and dynamic programming. Graph algorithms, sorting, searching, integer arithmetic, hashing, and NP-complete problems.",Tufts,"Medford, Massachusetts",algorithm,4,Algorithms,0,Math
9,CSE 633,Parallel Algorithms,"The course will focus on the design, implementation, and analysis of a parallel solution to an interesting problem on a state-of-the-art high-end computing system. The students will learn how to program contemporary shared-memory, distributed-memory, and GPGPU-based high-end computing systems. The course will also cover the design and analysis of fundamental parallel algorithms. Time and space complexity of solutions to problems from areas that include computational geometry, image analysis, and graph theory will be considered. Architectures include the PRAM, mesh, pyramid, mesh-of-trees, and hypercube.",University at Buffalo,"Buffalo, New York",algorithm,4,Algorithms,0,Math
10,COMPSCI 690AA,Approximation Algorithms,"Many important problems that arise in practical applications of discrete optimization are NP-hard. This implies no polynomial time algorithms exist for these problems unless P==NP. The field of approximation algorithms has developed to tackle this difficulty by designing polynomial time algorithms to solve otherwise intractable problems near-optimally. Approximation algorithms provide rigorous guarantees on approximation factors indicating how far the solution can be in the worst case. This paradigm has become a cornerstone in algorithm design, and this course aims to cover a comprehensive list of topics in this area at the graduate level. Towards the end of the course, we will also explore hardness of approximation : study of the best approximation factor possible in polynomial time. A tentative list of topics include: Techniques: Greedy algorithms, local search, dynamic programming, randomized methods, LP techniques, primal-dual method, lagrangian methods, semi-definite programming, metric method, hardness of approximation. Problems: Set cover, Vertex cover, TSP and other planning problems, Scheduling and Generalized assignment problems, Facility Location, Steiner tree and other network design problems, Sparsest cut, multicut and other graph partitioning problems, MaxSat, Graph coloring, Approximate counting, Algorithms on sequences etc.",University of Massachusetts--Amherst,"Amherst, Massachusetts","approximation, algorithm",4,Algorithms,0,Math
11,CSCI 570,Analysis of Algorithms,"Explores fundamental techniques such as recursion, Fourier transform ordering, dynamic programming for efficient algorithm construction. Examples include arithmetic, algebraic, graph, pattern matching, sorting, searching algorithms.",University of Southern California,"Los Angeles, California","analysis, algorithm",4,Algorithms,0,Math
12,COMPSCI 532,Design and Analysis of Algorithms,"Design and analysis of efficient algorithms. Algorithmic paradigms. Applications include sorting, searching, dynamic structures, graph algorithms, randomized algorithms. Computationally hard problems. NP completeness. Prerequisites: Computer Science 201 and 330 or equivalent.",Duke,"Durham, North Carolina","design, analysis, algorithm",4,Algorithms,0,Math
13,CS 535,Design and Analysis of Algorithms,"Design of efficient algorithms for a variety of problems, with mathematical proof of correctness and analysis of time and space requirements. Topics include lower bounds for sorting and medians, amortized analysis of advanced data structures, graph algorithms (strongly connected components, shortest paths, minimum spanning trees, maximum flows and bipartite matching) and NP-Completeness.",Illinois Institute of Tech,"Chicago, Illinois ","design, analysis, algorithm",4,Algorithms,0,Math
14,CS 557,Cyber-Physical Systems: Networking and Algorithms,"Cyber-physical systems (CPS) are engineered systems that are built from, and depend upon, the seamless integration of computation and physical components. CPS can form a unifying modeling framework for many different scientific and engineering problems. Examples include, but are not limited to, internet of things (IoT), building design, civil infrastructure, energy, healthcare and personalized medicine, manufacturing, and transportation. This course will teach various topics in cyber-physical systems security. The goal is to expose students to fundamental security principles specific to cyber-physical systems and to apply them to a broad range of current and future security challenges. Students will work with various tools and techniques used by hackers to compromise computer systems or otherwise interfere with normal operations. Students will undertake a semester-long research project with the goal of technical publications. Lecture topics will include, but not limited to: 1. Introduction to Cyber-Physical Systems 2. Control Systems and Operations 3. Cyber-Physical System Security History and Threats 4. Cyber-Physical System Design and Architecture 5. Critical infrastructure protection (e.g., Power Systems) 6. Security in Cyber-Physical Systems 7. Cyber-Resilience in Cyber-Physical Systems 8. Privacy in Cyber-Physical Systems.",Illinois Institute of Tech,"Chicago, Illinois ","networking, algorithm",4,Algorithms,0,Math
15,CS 513/514,Advanced Algorithms,This course goes beyond 198:513 in introducing the student to new concepts and techniques used in the study of algorithms. It is intended to serve students specializing in a number of different areas within computer science.,Rutgers,"New Brunswick, New Jersey",algorithm,4,Algorithms,0,Math
16,CME 305,Discrete Mathematics and Algorithms,"Topics: Basic Algebraic Graph Theory, Matroids and Minimum Spanning Trees, Submodularity and Maximum Flow, NP-Hardness, Approximation Algorithms, Randomized Algorithms, The Probabilistic Method, and Spectral Sparsification using Effective Resistances. Topics will be illustrated with applications from Distributed Computing, Machine Learning, and large-scale Optimization.",Stanford,"Stanford, California ",algorithm,4,Algorithms,0,Math
17,EC ENGR 219,Large-Scale Data Mining: Models and Algorithms,"Introduction of variety of scalable data modeling tools, both predictive and causal, from different disciplines. Topics include supervised and unsupervised data modeling tools from machine learning, such as support vector machines, different regression engines, different types of regularization and kernel techniques, deep learning, and Bayesian graphical models. Emphasis on techniques to evaluate relative performance of different methods and their applicability. Includes computer projects that explore entire data analysis and modeling cycle: collecting and cleaning large-scale data, deriving predictive and causal models, and evaluating performance of different models.",UCLA,"Los Angeles, California",mining,10,Data Mining,1,Data Mining
18,EC EGNR 232E,Large-Scale Social and Complex Networks: Design and Algorithms,"Modeling and design of large-scale complex networks, including social networks, peer-to-peer file-sharing networks, World Wide Web, and gene networks. Modeling of characteristic topological features of complex networks, such as power laws and percolation threshold. Mining topology to design algorithms for various applications, such as e-mail spam detection, friendship recommendations, viral popularity, and epidemics. Introduction to network algorithms, computational complexity, and nondeterministic, polynomial-time completeness.",UCLA,"Los Angeles, California","design, algorithm",4,Algorithms,0,Math
19,COMPSCI 611,Advanced Algorithms,"Principles underlying the design and analysis of efficient algorithms. Topics to be covered include: divide-and-conquer algorithms, graph algorithms, matroids and greedy algorithms, randomized algorithms, NP-completeness, approximation algorithms, linear programming.",University of Massachusetts--Amherst,"Amherst, Massachusetts",algorithm,4,Algorithms,0,Math
20,CSC 482,Design & Analysis of Efficient Algorithms,"How does one design programs and ascertain their efficiency? Divide-and-conquer techniques, string processing, graph algorithms, mathematical algorithms. Advanced data structures such as balanced tree schemes. Introduction to NP-completeness and intractable combinatorial search, optimization, and decision problems.",University of Rochester,"Rochester, New York","design, analysis, algorithm",4,Algorithms,0,Math
21,CS 557,Cyber-Physical Systems: Networking and Algorithms,"Cyber-physical systems (CPS) are engineered systems that are built from, and depend upon, the seamless integration of computation and physical components. CPS can form a unifying modeling framework for many different scientific and engineering problems. Examples include, but are not limited to, internet of things (IoT), building design, civil infrastructure, energy, healthcare and personalized medicine, manufacturing, and transportation. This course will teach various topics in cyber-physical systems security. The goal is to expose students to fundamental security principles specific to cyber-physical systems and to apply them to a broad range of current and future security challenges. Students will work with various tools and techniques used by hackers to compromise computer systems or otherwise interfere with normal operations. Students will undertake a semester-long research project with the goal of technical publications. Lecture topics will include, but not limited to: 1. Introduction to Cyber-Physical Systems 2. Control Systems and Operations 3. Cyber-Physical System Security History and Threats 4. Cyber-Physical System Design and Architecture 5. Critical infrastructure protection (e.g., Power Systems) 6. Security in Cyber-Physical Systems 7. Cyber-Resilience in Cyber-Physical Systems 8. Privacy in Cyber-Physical Systems.",Illinois Institute of Tech,"Chicago, Illinois ","networking, algorithm",4,Algorithms,0,Math
22,CS 513/514,Advanced Algorithms,This course goes beyond 198:513 in introducing the student to new concepts and techniques used in the study of algorithms. It is intended to serve students specializing in a number of different areas within computer science.,Rutgers,"New Brunswick, New Jersey",algorithm,4,Algorithms,0,Math
23,CME 305,Discrete Mathematics and Algorithms,"Topics: Basic Algebraic Graph Theory, Matroids and Minimum Spanning Trees, Submodularity and Maximum Flow, NP-Hardness, Approximation Algorithms, Randomized Algorithms, The Probabilistic Method, and Spectral Sparsification using Effective Resistances. Topics will be illustrated with applications from Distributed Computing, Machine Learning, and large-scale Optimization.",Stanford,"Stanford, California ",algorithm,4,Algorithms,0,Math
24,COMPSCI 611,Advanced Algorithms,"Principles underlying the design and analysis of efficient algorithms. Topics to be covered include: divide-and-conquer algorithms, graph algorithms, matroids and greedy algorithms, randomized algorithms, NP-completeness, approximation algorithms, linear programming.",University of Massachusetts--Amherst,"Amherst, Massachusetts",algorithm,4,Algorithms,0,Math
25,C S 235,Data Structures and Algorithms,"Fundamental data structures and algorithms of computer science; basic algorithm analysis; recursion; sorting and searching; lists, stacks, queues, trees, hashing; object-oriented data abstraction.",Brigham Young ,"Provo, Utah",algorithm,4,Algorithms,0,Math
26,CSOR W4246,Algorithms for Data Science,"Methods for organizing data, e.g. hashing, trees, queues, lists, priority queues. Streaming algorithms for computing statistics on the data. Sorting and searching. Basic graph models and algorithms for searching, shortest paths, and matching. Dynamic programming. Linear and convex programming. Floating point arithmetic, stability of numerical algorithms, Eigenvalues, singular values, PCA, gradient descent, stochastic gradient descent, and block coordinate descent. Conjugate gradient, Newton and quasi-Newton methods. Large scale applications from signal processing, collaborative filtering, recommendations systems, etc.",Columbia,"New York City, New York","algorithm, science",4,Algorithms,0,Math
27,685.621,Algorithms for Data Science,"This follow-on course to data structures (e.g., 605.202 Data Structures), providing a survey of computer algorithms, examines fundamental techniques in algorithm design and analysis, and develops problem-solving skills required in all programs of study involving data science. Topics include: advanced data structures for data science (tree structures, disjoint set data structures), algorithm analysis and computational complexity [recurrence relations, big-O notation, introduction to complexity classes (P, NP and NP-completeness)], data transformations (FFTs, principal component analysis), design paradigms (divide and conquer, greedy heuristic, dynamic programming), and graph algorithms (depth-first and breadth-first search, ordered and unordered trees). Advanced topics are selected from among the following: approximation algorithms, computational geometry, data preprocessing methods, data analysis, linear programming, multi-threaded algorithms, matrix operations, and statistical learning methods. The course will draw on applications from Data Science.",Johns Hopkins,"Baltimore, Maryland","algorithm, science",4,Algorithms,0,Math
28,CS 512,Data Structrues & Algorithms,The course studies a variety of useful algorithms and analyze their complexity; students will gain insight into principles and data-structures useful in algorithm design.,Rutgers,"New Brunswick, New Jersey",algorithm,4,Algorithms,0,Math
29,COMP 4581,Algorithms for Data Science,"This course introduces the design and analysis of algorithms within the context of data science. Topics include; asymptotic complexity and algorithm design techniques such as incremental, divide and conquer, dynamic programming, randomization, greedy algorithms, and advanced sorting techniques. Examples to illustrate techniques are drawn from multi-dimensional clustering (k-means and probabilistic), regression, decision trees, order statistics, data mining using apriori algorithms, and algorithms for generating combinatorial objects.",University of Denver,"Denver, Colorado","algorithm, science",4,Algorithms,0,Math
30,COMPSCI 514,Algorithms for Data Science,"With the advent of social networks, ubiquitous sensors, and large-scale computational science, data scientists must deal with data that is massive in size, arrives at blinding speeds, and often must be processed within interactive or quasi-interactive time frames. This course studies the mathematical foundations of big data processing, developing algorithms and learning how to analyze them. We explore methods for sampling, sketching, and distributed processing of large scale databases, graphs, and data streams for purposes of scalable statistical description, querying, pattern mining, and learning.",University of Massachusetts--Amherst,"Amherst, Massachusetts","algorithm, science",4,Algorithms,0,Math
31,DATA 516,Scalable Data Systems & Algorithms,"This course focuses on principles and algorithms for data management and analysis at scale. We’ll cover designs of and how to use traditional and modern big data systems, as well as the basics of cloud computing.",University of Washington,"Seattle, Washington",algorithm,4,Algorithms,0,Math
32,5440,Data Science Algorithms,"An applied and practical combination of discrete structures and computational algorithms that are relevant for data science applications and infrastructure. Topics include natural language processing, graph and network models, (stochastic) gradient descent, block coordinate descent, and (quasi-) newton methods along with an overview of more traditional topics such as sorting and searching, hashing, queues, trees, string processing, advanced data structures, recurrence relations, shortest paths, matching, and dynamic programming. The course will also cover streaming algorithms for computational statistics, e.g., Monte-Carlo Markov Chain, simulated annealing, and stability of numerical algorithms.",Vanderbilt University,"Nashville, Tennessee","science, algorithm",4,Algorithms,0,Math
33,CS 557,Artificial Intelligence,"This course covers core areas of Artificial Intelligence including perception, optimization, reasoning, learning, planning, decision--making, knowledge representation, vision and robotics.",Emory,"Atlanta, Georgia ",intelligence,6,Theory,0,Math
34,CS 5100,Foundations of Artificial Intelligence,"Introduces the fundamental problems, theories, and algorithms of the artificial intelligence field. Topics include heuristic search and game trees, knowledge representation using predicate calculus, automated deduction and its applications, problem solving and planning, and introduction to machine learning. Required course work includes the creation of working programs that solve problems, reason logically, and/or improve their own performance using techniques presented in the course. Requires experience in Java programming.",Northeastern,"Boston, Massachusetts",intelligence,6,Theory,0,Math
35,CS 7180,Special Topics in Artificial Intelligence,Offers various topics on artificial intelligence. May be repeated up to two times.,Northeastern,"Boston, Massachusetts",intelligence,6,Theory,0,Math
36,MSDS 458,DL Artificial Intelligence and Deep Learning,"An introduction to the field of artificial intelligence, this course illustrates probability-rule-based generative models as well as discriminative models that learn from training data. The course reviews applications of artificial intelligence and deep learning in vision and language processing. Students learn best practices for building supervised learning models and, in particular, deep neural networks for classification and regression. Students also learn about feature engineering, autoencoders, and strategies of unsupervised and semi-supervised learning, as well as reinforcement learning. This is a project-based course with extensive programming assignments.",Northwestern,"Evanston, Illinois","intelligence, learning",5,Deep Learning,4,Machine Learning
37,MSDS 458,DL Artificial Intelligence and Deep Learning,"An introduction to the field of artificial intelligence, this course illustrates probability-rule-based generative models as well as discriminative models that learn from training data. The course reviews applications of artificial intelligence and deep learning in vision and language processing. Students learn best practices for building supervised learning models and, in particular, deep neural networks for classification and regression. Students also learn about feature engineering, autoencoders, and strategies of unsupervised and semi-supervised learning, as well as reinforcement learning. This is a project-based course with extensive programming assignments.",Northwestern,"Evanston, Illinois","intelligence, learning",5,Deep Learning,4,Machine Learning
38,CS 520,Artificial Intelligence,"This course is intended to provide a broad practical introduction to the concepts and methods in the field of artificial intelligence. ”AI” represents a very diverse field of problems and techniques - we will focus on topics and ideas with broad application. The main focus and takeaway from this course should be the systematic representation of knowledge and the manipulation of these representations for general problem solving. If a problem can be represented systematically, any number of algorithmic techniques can be leveraged against it. Many of these algorithms will seem natural if not utterly naive - but applying them to appropriately represented and realized problems lends them power and generalizability.",Rutgers,"New Brunswick, New Jersey",intelligence,6,Theory,0,Math
39,COMP 131,Artificial Intelligence,"History, theory, and computational methods of artificial intelligence. Basic concepts include representation of knowledge and computational methods for reasoning. One or two application areas will be studied, to be selected from expert systems, robotics, computer vision, natural language understanding, and planning.",Tufts,"Medford, Massachusetts",intelligence,6,Theory,0,Math
40,COMPSCI 683,Artificial Intelligence,"In-depth introduction to Artificial Intelligence focusing on techniques that allow intelligent systems to reason effectively with uncertain information and cope limited computational resources. Topics include: problem-solving using search, heuristic search techniques, constraint satisfaction, local search, abstraction and hierarchical search, resource-bounded search techniques, principles of knowledge representation and reasoning, logical inference, reasoning under uncertainty, belief networks, decision theoretic reasoning, representing and reasoning about preferences, planning under uncertainty using Markov decision processes, multi-agent systems, and computational models of bounded rationality.",University of Massachusetts--Amherst,"Amherst, Massachusetts",intelligence,6,Theory,0,Math
